Lists of sequenced genomes,https://en.wikipedia.org/?curid=39868995,,,,Lists of organisms by population,https://en.wikipedia.org/?curid=37486008,,,,Lists of mammals by population,https://en.wikipedia.org/?curid=37663214,,,,Lists about the pharmaceutical industry,https://en.wikipedia.org/?curid=43720735,,,,List of xanthoma variants associated with hyperlipoproteinemia subtypes,https://en.wikipedia.org/?curid=36978429,,,,List of vocoders,https://en.wikipedia.org/?curid=35176974,,,,List of virus families and subfamilies,https://en.wikipedia.org/?curid=37315646,,,,List of verrucous carcinoma subtypes,https://en.wikipedia.org/?curid=36961844,,,,List of veins of the human body,https://en.wikipedia.org/?curid=42087576,,,,List of vaccine topics,https://en.wikipedia.org/?curid=2114227,,,,List of unsolved problems in medicine,https://en.wikipedia.org/?curid=48846633,,,,List of unsolved problems in biology,https://en.wikipedia.org/?curid=26167757,,,,List of unproven and disproven cancer treatments,https://en.wikipedia.org/?curid=40370421,,,,List of Trogoniformes by population,https://en.wikipedia.org/?curid=38000528,,,,List of therapies,https://en.wikipedia.org/?curid=29790,,,,List of systems of the human body,https://en.wikipedia.org/?curid=42087655,,,,List of systemic diseases with ocular manifestations,https://en.wikipedia.org/?curid=1266250,,,,List of syphilis cases,https://en.wikipedia.org/?curid=32124842,,,,List of symbiotic relationships,https://en.wikipedia.org/?curid=1096264,,,,List of Struthioniformes by population,https://en.wikipedia.org/?curid=38000679,,,,List of Strigiformes by population,https://en.wikipedia.org/?curid=38000727,,,,List of Sphenisciformes by population,https://en.wikipedia.org/?curid=37934124,,,,List of sovereign states and dependent territories by mortality rate,https://en.wikipedia.org/?curid=2721921,,,,List of skeletal muscles of the human body,https://en.wikipedia.org/?curid=13691619,,,,List of Setswana medical terms,https://en.wikipedia.org/?curid=45679508,,,,List of sequenced protist genomes,https://en.wikipedia.org/?curid=35929255,,,,List of sequenced plastomes,https://en.wikipedia.org/?curid=18667488,,,,List of sequenced plant genomes,https://en.wikipedia.org/?curid=33362511,,,,List of sequenced fungi genomes,https://en.wikipedia.org/?curid=33346197,,,,List of sequenced eukaryotic genomes,https://en.wikipedia.org/?curid=6938627,,,,List of sequenced archaeal genomes,https://en.wikipedia.org/?curid=8815086,,,,List of sequenced animal genomes,https://en.wikipedia.org/?curid=35917093,,,,List of seaweeds of South Africa,https://en.wikipedia.org/?curid=26077876,,,,List of seaweeds and marine flowering plants of Australia (temperate waters),https://en.wikipedia.org/?curid=41777152,,,,List of questionable diagnostic tests,https://en.wikipedia.org/?curid=46821559,,,,List of Psittaciformes by population,https://en.wikipedia.org/?curid=37969104,,,,List of Procellariiformes by population,https://en.wikipedia.org/?curid=37969019,,,,List of primates by population,https://en.wikipedia.org/?curid=37894720,,,,List of population genetics projects,https://en.wikipedia.org/?curid=42444749,,,,List of plants used in herbalism,https://en.wikipedia.org/?curid=438677,,,,List of plant orders,https://en.wikipedia.org/?curid=10084913,,,,List of Piciformes by population,https://en.wikipedia.org/?curid=37968870,,,,List of physiologists,https://en.wikipedia.org/?curid=39198918,,,,List of Phoenicopteriformes by population,https://en.wikipedia.org/?curid=37934093,,,,List of phobias,https://en.wikipedia.org/?curid=48743,,,,List of pharmaceutical companies,https://en.wikipedia.org/?curid=62424,,,,List of patient-reported quality of life surveys,https://en.wikipedia.org/?curid=40985409,,,,List of Passeriformes by population,https://en.wikipedia.org/?curid=49554785,,,,List of participants in the Evolving Genes and Proteins symposium,https://en.wikipedia.org/?curid=11309231,,,,List of parasitic organisms,https://en.wikipedia.org/?curid=37660,,,,List of organs of the human body,https://en.wikipedia.org/?curid=41431754,,,,List of organisms by chromosome count,https://en.wikipedia.org/?curid=3037408,,,,List of OMIM disorder codes,https://en.wikipedia.org/?curid=30098993,,,,List of OECD countries by hospital beds,https://en.wikipedia.org/?curid=42662819,,,,List of odd-toed ungulates by population,https://en.wikipedia.org/?curid=37894797,,,,List of Nvidia graphics processing units,https://en.wikipedia.org/?curid=3263352,,,,List of non-fictional lost worlds,https://en.wikipedia.org/?curid=8241706,,,,List of neuroscience databases,https://en.wikipedia.org/?curid=25829369,,,,List of nerves of the human body,https://en.wikipedia.org/?curid=2580333,,,,List of movements of the human body,https://en.wikipedia.org/?curid=41894825,,,,List of model organisms,https://en.wikipedia.org/?curid=45270286,,,,List of mites associated with cutaneous reactions,https://en.wikipedia.org/?curid=37002880,,,,List of microorganisms tested in outer space,https://en.wikipedia.org/?curid=40170111,,,,List of micronutrients,https://en.wikipedia.org/?curid=5925183,,,,List of medical triads and pentads,https://en.wikipedia.org/?curid=37780521,,,,List of medical textbooks,https://en.wikipedia.org/?curid=43402636,,,,List of medical symptoms,https://en.wikipedia.org/?curid=646673,,,,"List of medical roots, suffixes and prefixes",https://en.wikipedia.org/?curid=8611983,,,,List of medical professionals who died during the SARS outbreak,https://en.wikipedia.org/?curid=38563792,,,,List of medical organisations,https://en.wikipedia.org/?curid=2965208,,,,List of medical mnemonics,https://en.wikipedia.org/?curid=40780391,,,,List of medical abbreviations: Z,https://en.wikipedia.org/?curid=16982255,,,,List of medical abbreviations: Y,https://en.wikipedia.org/?curid=16982233,,,,List of medical abbreviations: X,https://en.wikipedia.org/?curid=16982225,,,,List of medical abbreviations: W,https://en.wikipedia.org/?curid=16982214,,,,List of medical abbreviations: V,https://en.wikipedia.org/?curid=16982202,,,,List of medical abbreviations: U,https://en.wikipedia.org/?curid=16982191,,,,List of medical abbreviations: T,https://en.wikipedia.org/?curid=16982180,,,,List of medical abbreviations: S,https://en.wikipedia.org/?curid=16982116,,,,List of medical abbreviations: R,https://en.wikipedia.org/?curid=16982103,,,,List of medical abbreviations: Q,https://en.wikipedia.org/?curid=16982056,,,,List of medical abbreviations: P,https://en.wikipedia.org/?curid=16982046,,,,List of medical abbreviations: O,https://en.wikipedia.org/?curid=16982035,,,,List of medical abbreviations: N,https://en.wikipedia.org/?curid=16982025,,,,List of medical abbreviations: M,https://en.wikipedia.org/?curid=16982000,,,,List of medical abbreviations: Latin abbreviations,https://en.wikipedia.org/?curid=16982378,,,,List of medical abbreviations: L,https://en.wikipedia.org/?curid=16981984,,,,List of medical abbreviations: K,https://en.wikipedia.org/?curid=16981959,,,,List of medical abbreviations: J,https://en.wikipedia.org/?curid=16981943,,,,List of medical abbreviations: I,https://en.wikipedia.org/?curid=16981931,,,,List of medical abbreviations: H,https://en.wikipedia.org/?curid=16981911,,,,List of medical abbreviations: G,https://en.wikipedia.org/?curid=16981898,,,,List of medical abbreviations: F,https://en.wikipedia.org/?curid=16981861,,,,List of medical abbreviations: E,https://en.wikipedia.org/?curid=16981837,,,,List of medical abbreviations: D,https://en.wikipedia.org/?curid=16981827,,,,List of medical abbreviations: C,https://en.wikipedia.org/?curid=16981812,,,,List of medical abbreviations: B,https://en.wikipedia.org/?curid=16981750,,,,List of medical abbreviations: A,https://en.wikipedia.org/?curid=16981730,,,,List of medical abbreviations: 09,https://en.wikipedia.org/?curid=16981682,,,,List of medical abbreviations,https://en.wikipedia.org/?curid=50973,,,,List of marine ecoregions,https://en.wikipedia.org/?curid=13366494,,,,List of macronutrients,https://en.wikipedia.org/?curid=5925110,,,,List of lymph nodes of the human body,https://en.wikipedia.org/?curid=42087672,,,,List of longest-living organisms,https://en.wikipedia.org/?curid=4622751,,,,List of Legionnaires' disease outbreaks,https://en.wikipedia.org/?curid=38894374,,,,List of kampo herbs,https://en.wikipedia.org/?curid=9179093,,,,List of invasive species in North America,https://en.wikipedia.org/?curid=24695021,,,,List of invasive species in Europe,https://en.wikipedia.org/?curid=24694990,,,,List of Intel graphics processing units (2013 or earlier),https://en.wikipedia.org/?curid=52137353,,,,List of Intel graphics processing units,https://en.wikipedia.org/?curid=25839957,,,,"List of instruments used in otorhinolaryngology, head and neck surgery",https://en.wikipedia.org/?curid=17545325,,,,List of institutes and centers of the National Institutes of Health,https://en.wikipedia.org/?curid=40688661,,,,List of important publications in medicine,https://en.wikipedia.org/?curid=815067,,,,List of ICD-9 codes,https://en.wikipedia.org/?curid=1985416,,,,List of human leukocyte antigen alleles associated with cutaneous conditions,https://en.wikipedia.org/?curid=36971126,,,,List of human genes,https://en.wikipedia.org/?curid=1639390,,,,List of human blood components,https://en.wikipedia.org/?curid=466401,,,,List of human anatomical parts named after people,https://en.wikipedia.org/?curid=463516,,,,List of human anatomical features,https://en.wikipedia.org/?curid=168206,,,,List of herbaria in North America,https://en.wikipedia.org/?curid=18027464,,,,List of herbaria in Europe,https://en.wikipedia.org/?curid=18032715,,,,List of herbaria,https://en.wikipedia.org/?curid=18012286,,,,List of hematologic conditions,https://en.wikipedia.org/?curid=30623481,,,,List of habitats of principal importance in Wales,https://en.wikipedia.org/?curid=53261437,,,,List of GlaxoSmithKline products,https://en.wikipedia.org/?curid=38815844,,,,List of glands of the human body,https://en.wikipedia.org/?curid=42030981,,,,List of geneticists,https://en.wikipedia.org/?curid=1532897,,,,List of genetic genealogy topics,https://en.wikipedia.org/?curid=6153690,,,,List of genes mutated in pigmented cutaneous lesions,https://en.wikipedia.org/?curid=36962320,,,,List of genera of viruses,https://en.wikipedia.org/?curid=9731834,,,,List of gene families,https://en.wikipedia.org/?curid=342094,,,,List of Gaviiformes by population,https://en.wikipedia.org/?curid=37924849,,,,List of Galliformes by population,https://en.wikipedia.org/?curid=37933612,,,,List of foramina of the human body,https://en.wikipedia.org/?curid=4286343,,,,List of Falconiformes by population,https://en.wikipedia.org/?curid=37924766,,,,List of examples of convergent evolution,https://en.wikipedia.org/?curid=19643233,,,,List of even-toed ungulates by population,https://en.wikipedia.org/?curid=37894917,,,,List of Ebola outbreaks,https://en.wikipedia.org/?curid=25227114,,,,List of Dwarfism media depictions,https://en.wikipedia.org/?curid=22671755,,,,List of distinct cell types in the adult human body,https://en.wikipedia.org/?curid=466315,,,,List of disorders of foot and ankle,https://en.wikipedia.org/?curid=7671190,,,,List of disorders included in newborn screening programs,https://en.wikipedia.org/?curid=36732637,,,,List of disabled human pseudogenes,https://en.wikipedia.org/?curid=27580988,,,,List of cutaneous neoplasms associated with systemic syndromes,https://en.wikipedia.org/?curid=36962623,,,,List of Cuculiformes by population,https://en.wikipedia.org/?curid=37924611,,,,List of countries with universal health care,https://en.wikipedia.org/?curid=35458791,,,,List of countries by total health expenditure per capita,https://en.wikipedia.org/?curid=23828717,,,,List of countries by risk of death from non-communicable disease,https://en.wikipedia.org/?curid=42766494,,,,List of countries by quality of healthcare,https://en.wikipedia.org/?curid=42870895,,,,List of countries by infant mortality rate,https://en.wikipedia.org/?curid=2525954,,,,List of countries by health insurance coverage,https://en.wikipedia.org/?curid=38758207,,,,List of countries by health expenditure covered by government,https://en.wikipedia.org/?curid=42866549,,,,List of countries by cremation rate,https://en.wikipedia.org/?curid=28741923,,,,List of countries by body mass index,https://en.wikipedia.org/?curid=49541051,,,,List of Coraciiformes by population,https://en.wikipedia.org/?curid=37924503,,,,List of contaminated cell lines,https://en.wikipedia.org/?curid=3983382,,,,List of Columbiformes by population,https://en.wikipedia.org/?curid=37899283,,,,List of clinically important bacteria,https://en.wikipedia.org/?curid=1465195,,,,List of Ciconiiformes by population,https://en.wikipedia.org/?curid=37899152,,,,List of chordate orders,https://en.wikipedia.org/?curid=309910,,,,List of Charadriiformes by population,https://en.wikipedia.org/?curid=37895380,,,,List of centers and institutes at the Perelman School of Medicine,https://en.wikipedia.org/?curid=33562655,,,,List of causes of genital pain,https://en.wikipedia.org/?curid=48757814,,,,List of carnivorans by population,https://en.wikipedia.org/?curid=37894892,,,,List of cancer mortality rates in the United States,https://en.wikipedia.org/?curid=3551105,,,,List of camouflage methods,https://en.wikipedia.org/?curid=38486257,,,,List of bones of the human skeleton,https://en.wikipedia.org/?curid=242621,,,,List of birds by population,https://en.wikipedia.org/?curid=37900505,,,,List of biophysically important macromolecular crystal structures,https://en.wikipedia.org/?curid=41883177,,,,List of biology websites,https://en.wikipedia.org/?curid=18201005,,,,List of biogerontologists,https://en.wikipedia.org/?curid=48429002,,,,List of biodiversity databases,https://en.wikipedia.org/?curid=6331838,,,,List of ATI chipsets,https://en.wikipedia.org/?curid=7450068,,,,List of arteries of the human body,https://en.wikipedia.org/?curid=42087572,,,,List of Apodiformes by population,https://en.wikipedia.org/?curid=37895228,,,,List of antimicrobial peptides in the female reproductive tract,https://en.wikipedia.org/?curid=50951887,,,,List of Anseriformes by population,https://en.wikipedia.org/?curid=37895120,,,,List of animals that produce silk,https://en.wikipedia.org/?curid=42981259,,,,List of animals by number of neurons,https://en.wikipedia.org/?curid=8280867,,,,List of anatomical isthmi,https://en.wikipedia.org/?curid=2452242,,,,List of AMD graphics processing units,https://en.wikipedia.org/?curid=3898076,,,,List of AMD chipsets,https://en.wikipedia.org/?curid=21772137,,,,List of acupuncture points,https://en.wikipedia.org/?curid=11005395,,,,List of abbreviations used in medical prescriptions,https://en.wikipedia.org/?curid=14470466,,,,List of abbreviations for medical organisations and personnel,https://en.wikipedia.org/?curid=68137,,,,List of abbreviations for diseases and disorders,https://en.wikipedia.org/?curid=22258844,,,,"List of A1 genes, proteins or receptors",https://en.wikipedia.org/?curid=20207005,,,,List of -ectomies,https://en.wikipedia.org/?curid=1134909,,,,Tokogeny,https://en.wikipedia.org/?curid=44057611,,,,0.623326906Alliance for Open Society International,https://en.wikipedia.org/?curid=19205811,,,,0.78702496Macro-engineering,https://en.wikipedia.org/?curid=2208744,,,,0.706917934Allometric engineering,https://en.wikipedia.org/?curid=30906179,,,,0.993080002RCF audio,https://en.wikipedia.org/?curid=55675485,,,,0.043581622HIV/AIDS in Europe,https://en.wikipedia.org/?curid=6021384,,,,0.109691845Healthcare in Iceland,https://en.wikipedia.org/?curid=24443937,,,,0.644671919Water purification in Africa,https://en.wikipedia.org/?curid=31422657,,,,0.05374568Index of HIV/AIDS-related articles,https://en.wikipedia.org/?curid=1364854,,,,0.652297287Media controls,https://en.wikipedia.org/?curid=31638066,,,,0.180347553ISCB Fellow,https://en.wikipedia.org/?curid=53551430,,,,0.011395079Clavicle fracture,https://en.wikipedia.org/?curid=1692549,,,,0.843347937Noise gate,https://en.wikipedia.org/?curid=1039345,,,,0.813708702Yamaha DSP-1,https://en.wikipedia.org/?curid=399590,,,,0.923603894Benchmark (computing),https://en.wikipedia.org/?curid=1980870,,,,0.562183081Healthcare in Georgia (country),https://en.wikipedia.org/?curid=21249816,,,,0.498780538Smith fracture,https://en.wikipedia.org/?curid=25416452,,,,0.889444742Galeazzi fracture,https://en.wikipedia.org/?curid=3486155,,,,0.587438807Tscherne classification,https://en.wikipedia.org/?curid=44896214,,,,0.042500326Engineering analysis,https://en.wikipedia.org/?curid=10543101,,,,0.963960624Trisa,https://en.wikipedia.org/?curid=54229636,,,,0.1106058732009 flu pandemic in Africa,https://en.wikipedia.org/?curid=23214484,,,,0.688663658Atomtronics,https://en.wikipedia.org/?curid=11630614,,,,0.360206496Ambio 4,https://en.wikipedia.org/?curid=50603900,,,,0.117736456Independent Engineer,https://en.wikipedia.org/?curid=54051270,,,,0.873987867CyberGIS,https://en.wikipedia.org/?curid=49858188,,,,0.287215198Average CPU power,https://en.wikipedia.org/?curid=13242122,,,,0.74481946"African Journal of Traditional, Complementary and Alternative Medicines",https://en.wikipedia.org/?curid=23861360,,,,0.933660101Design review (U.S. government),https://en.wikipedia.org/?curid=23458190,,,,0.698700916PerfKitBenchmarker,https://en.wikipedia.org/?curid=47322010,,,,0.505419567Sulfide intrusion,https://en.wikipedia.org/?curid=49158055,,,,0.151244583Anatomical terminology,https://en.wikipedia.org/?curid=41101954,,,,0.405611543Triploid block,https://en.wikipedia.org/?curid=44055899,,,,0.064337094Displacement (orthopedic surgery),https://en.wikipedia.org/?curid=2299540,,,,0.227123131P-Aminobenzoyl-glutamate transporter,https://en.wikipedia.org/?curid=49633163,,,,0.387293551Hangman's fracture,https://en.wikipedia.org/?curid=6006775,,,,0.927390657Bonnie++,https://en.wikipedia.org/?curid=42080228,,,,0.98572815Healthcare in Germany,https://en.wikipedia.org/?curid=16539901,,,,0.80039153Longevity in Okinawa,https://en.wikipedia.org/?curid=52307187,,,,0.105212088Schaffer-Vega Diversity System,https://en.wikipedia.org/?curid=34606312,,,,0.648741431Healthcare in Tristan da Cunha,https://en.wikipedia.org/?curid=52673254,,,,0.057738038Hyoid bone fracture,https://en.wikipedia.org/?curid=48545042,,,,0.416278183Crus fracture,https://en.wikipedia.org/?curid=30755279,,,,0.781485254Bamako Initiative,https://en.wikipedia.org/?curid=8543287,,,,0.380635366Music technology (electronic and digital),https://en.wikipedia.org/?curid=70924,,,,0.063627961Emergency medical responder levels by U.S. state,https://en.wikipedia.org/?curid=16621258,,,,0.337967586Outline of clinical research,https://en.wikipedia.org/?curid=19645563,,,,0.189930091Unit construction,https://en.wikipedia.org/?curid=5958446,,,,0.053146987Childbirth in Japan,https://en.wikipedia.org/?curid=31561998,,,,0.62998608Olecranon fracture,https://en.wikipedia.org/?curid=40485054,,,,0.529049897HIV/AIDS in North America,https://en.wikipedia.org/?curid=30635805,,,,0.22920458Thermophyte,https://en.wikipedia.org/?curid=52841665,,,,0.309131753Headphone amplifier,https://en.wikipedia.org/?curid=2193225,,,,0.510410654Health care in Venezuela,https://en.wikipedia.org/?curid=3877626,,,,0.38786777High throughput biology,https://en.wikipedia.org/?curid=18101603,,,,0.447209174Bumper fracture,https://en.wikipedia.org/?curid=24652286,,,,0.175451775Inkjet technology,https://en.wikipedia.org/?curid=46964830,,,,0.379962141HPC Challenge Benchmark,https://en.wikipedia.org/?curid=25911241,,,,0.125457075Data center infrastructure management,https://en.wikipedia.org/?curid=28088155,,,,0.354021478Data compression,https://en.wikipedia.org/?curid=8013,,,,0.083273135Bahima disease,https://en.wikipedia.org/?curid=22088120,,,,0.755251044Traditional engineering,https://en.wikipedia.org/?curid=1269245,,,,0.308577799Taxonomic list of viruses,https://en.wikipedia.org/?curid=45221774,,,,0.213746106Integrated amplifier,https://en.wikipedia.org/?curid=2086644,,,,0.859757761Native American ethnobotany,https://en.wikipedia.org/?curid=38068881,,,,0.110234463Biomaterial Surface Modifications,https://en.wikipedia.org/?curid=39337116,,,,0.7929171762009 flu pandemic in South America,https://en.wikipedia.org/?curid=23124809,,,,0.200310998Humanitarian engineering,https://en.wikipedia.org/?curid=18571741,,,,0.072505111Comparison of HP graphing calculators,https://en.wikipedia.org/?curid=18006752,,,,0.967553923Older People for Older People,https://en.wikipedia.org/?curid=37215345,,,,0.897046958Health care in Cyprus,https://en.wikipedia.org/?curid=21756530,,,,0.206614657Outline of engineering,https://en.wikipedia.org/?curid=9987,,,,0.271243704Standardization,https://en.wikipedia.org/?curid=27065,,,,0.390875266Sickle cell trait,https://en.wikipedia.org/?curid=4280556,,,,0.757452303Melarsoprol,https://en.wikipedia.org/?curid=1339605,,,,0.180400623Noma (disease),https://en.wikipedia.org/?curid=3138628,,,,0.627459537Healthcare in Egypt,https://en.wikipedia.org/?curid=43144300,,,,0.980868137Comparison of executable file formats,https://en.wikipedia.org/?curid=20560995,,,,0.721040723Betaine transporter,https://en.wikipedia.org/?curid=27492898,,,,0.097968918Biological organisation,https://en.wikipedia.org/?curid=8553751,,,,0.204447875Healthcare in Austria,https://en.wikipedia.org/?curid=31373406,,,,0.5700898Music technology,https://en.wikipedia.org/?curid=49182501,,,,0.008076601Healing,https://en.wikipedia.org/?curid=239217,,,,0.212177166Tibial plateau fracture,https://en.wikipedia.org/?curid=32544854,,,,0.029402723Engineering design management,https://en.wikipedia.org/?curid=2654494,,,,0.776113632Patella fracture,https://en.wikipedia.org/?curid=6246155,,,,0.190716905Water Talkies,https://en.wikipedia.org/?curid=11886943,,,,0.910420667Diploidization,https://en.wikipedia.org/?curid=54069375,,,,0.416786225NhaD family,https://en.wikipedia.org/?curid=49781600,,,,0.216346455Index of molecular biology articles,https://en.wikipedia.org/?curid=1374663,,,,0.486690634Double subscript notation,https://en.wikipedia.org/?curid=4253861,,,,0.272418029Healthcare in the Netherlands,https://en.wikipedia.org/?curid=15297282,,,,0.003058483Engineering drawing abbreviations and symbols,https://en.wikipedia.org/?curid=18536062,,,,0.600797429Flexure,https://en.wikipedia.org/?curid=1260106,,,,0.752906697Outline of biochemistry,https://en.wikipedia.org/?curid=3209677,,,,0.010059349Lorquin Entomological Society,https://en.wikipedia.org/?curid=50238405,,,,0.031288108Phase response curve,https://en.wikipedia.org/?curid=1556918,,,,0.044097936Bibliography of biology,https://en.wikipedia.org/?curid=33459185,,,,0.37825853Phoronix Test Suite,https://en.wikipedia.org/?curid=17118781,,,,0.129402194Cycles per byte,https://en.wikipedia.org/?curid=20902340,,,,0.272885877Electronic system,https://en.wikipedia.org/?curid=5518261,,,,0.198272104WATIAC,https://en.wikipedia.org/?curid=37953707,,,,0.538356162Reduced level,https://en.wikipedia.org/?curid=44115663,,,,0.22104432Healthcare in Greece,https://en.wikipedia.org/?curid=32512846,,,,0.97864583Comparison of encrypted external drives,https://en.wikipedia.org/?curid=26021738,,,,0.175867593Nicotinamide ribonucleoside uptake transporters,https://en.wikipedia.org/?curid=49292515,,,,0.512505955Ruedi-Allgower classification,https://en.wikipedia.org/?curid=46695267,,,,0.914696033Homolysis (biology),https://en.wikipedia.org/?curid=39269279,,,,0.09347847Tillaux fracture,https://en.wikipedia.org/?curid=44257849,,,,0.058696684FLOPS,https://en.wikipedia.org/?curid=82930,,,,0.303255805Housing (engineering),https://en.wikipedia.org/?curid=55321544,,,,0.478222905Kin recognition,https://en.wikipedia.org/?curid=11801835,,,,0.148514972Compensatory growth (organism),https://en.wikipedia.org/?curid=32000094,,,,0.783469162Childbirth in Ghana,https://en.wikipedia.org/?curid=46463468,,,,0.345147362Reliability-centered maintenance,https://en.wikipedia.org/?curid=4665840,,,,0.509880709Health care in the Palestinian territories,https://en.wikipedia.org/?curid=38045107,,,,0.444771062Gainclone,https://en.wikipedia.org/?curid=4672934,,,,0.673165819Health care in Turkey,https://en.wikipedia.org/?curid=16540901,,,,0.708861087Health care in France,https://en.wikipedia.org/?curid=20603142,,,,0.546757495Hardware architecture,https://en.wikipedia.org/?curid=3582323,,,,0.933583205Electrical system design,https://en.wikipedia.org/?curid=27047750,,,,0.346848309Portal:Biology,https://en.wikipedia.org/?curid=1470331,,,,0.12363213Compensatory growth (organ),https://en.wikipedia.org/?curid=23826998,,,,0.408441056Cervical fracture,https://en.wikipedia.org/?curid=1258362,,,,0.326579097Charles Darwin,https://en.wikipedia.org/?curid=8145410,,,,0.983934573Level of invention,https://en.wikipedia.org/?curid=1816558,,,,0.661349086807 (vacuum tube),https://en.wikipedia.org/?curid=22265215,,,,0.660695311Nucleobase cation symporter-2,https://en.wikipedia.org/?curid=35039952,,,,0.046808926Non-recurring engineering,https://en.wikipedia.org/?curid=1165697,,,,0.663686697Microbial rhodopsin,https://en.wikipedia.org/?curid=48050134,,,,0.129272963Comparison of embedded computer systems on board the Mars rovers,https://en.wikipedia.org/?curid=21134515,,,,0.147322673Engineer's Ring,https://en.wikipedia.org/?curid=12776956,,,,0.845155803Phaser (effect),https://en.wikipedia.org/?curid=1869488,,,,0.25681229RPerf,https://en.wikipedia.org/?curid=32615462,,,,0.085745556PCMark,https://en.wikipedia.org/?curid=6879482,,,,0.84485858Hierarchical INTegration,https://en.wikipedia.org/?curid=1081948,,,,0.785625412